news_headline,news_article,news_category,full_text,clean_text
Record number of civilians killed in Afghanistan conflict in 2018: UN,"A record number of Afghan civilians were killed last year due to stepped up aerial attacks by US-led forces and more suicide bombings, according to the UN. The conflict claimed 3,804 civilian lives, an 11% spike in deaths as compared to 2017. ""The best way to halt the killings of civilians is to stop the fighting,"" the UN said.",world,"Record number of civilians killed in Afghanistan conflict in 2018: UN. A record number of Afghan civilians were killed last year due to stepped up aerial attacks by US-led forces and more suicide bombings, according to the UN. The conflict claimed 3,804 civilian lives, an 11% spike in deaths as compared to 2017. ""The best way to halt the killings of civilians is to stop the fighting,"" the UN said.",record number civilian kill afghanistan conflict un record number afghan civilian kill last year due step aerial attack us lead force suicide bombing accord un conflict claim civilian life spike death compare good way halt killing civilian stop fighting un say
Trump's message on 5G clear and correct: Huawei Chairman,"Chinese telecom equipment maker Huawei's Chairman Guo Ping has said US President Trump's assertion that the US needs ""faster"" 5G technology through competition was ""clear and correct"". The US does not represent the whole world and Huawei could continue to succeed without it, he added. This comes amid allegations by the US that Huawei has enabled Chinese state espionage. ",world,"Trump's message on 5G clear and correct: Huawei Chairman. Chinese telecom equipment maker Huawei's Chairman Guo Ping has said US President Trump's assertion that the US needs ""faster"" 5G technology through competition was ""clear and correct"". The US does not represent the whole world and Huawei could continue to succeed without it, he added. This comes amid allegations by the US that Huawei has enabled Chinese state espionage. ",trump message g clear correct huawei chairman chinese telecom equipment maker huaweis chairman guo ping say us president trump assertion us need fast g technology competition clear correct us not represent whole world huawei could continue succeed without add come amid allegation us huawei enable chinese state espionage
Amazon Air cargo plane crashes in Texas with three on board,"American airline Atlas Air-operated Amazon Air cargo plane crashed in Texas with three on board. The Boeing 767 cargo jetliner flying from Miami to Houston, Texas lost radio contact 48 km from Houston's George Bush Intercontinental Airport, officials said.  ""Our...prayers are with the flight crew, their families and friends...during this terrible tragedy,"" Amazon worldwide operations SVP said.  ",world,"Amazon Air cargo plane crashes in Texas with three on board. American airline Atlas Air-operated Amazon Air cargo plane crashed in Texas with three on board. The Boeing 767 cargo jetliner flying from Miami to Houston, Texas lost radio contact 48 km from Houston's George Bush Intercontinental Airport, officials said.  ""Our...prayers are with the flight crew, their families and friends...during this terrible tragedy,"" Amazon worldwide operations SVP said.  ",amazon air cargo plane crash texas three board american airline atlas air operate amazon air cargo plane crash texas three board boeing cargo jetliner fly miami houston texas lose radio contact km houston george bush intercontinental airport official say prayer flight crew family friend terrible tragedy amazon worldwide operation svp say
"2 killed, 17 injured in clashes at Venezuela-Brazil border","At least two people were killed and 17 others were injured in clashes at Venezuela's border with Brazil, authorities said. Venezuelan security forces opened fire on a group of civilians who tried to prevent them from blocking the border. President Nicolás Maduro has closed the country's border with Brazil amid a row over the delivery of humanitarian aid.",world,"2 killed, 17 injured in clashes at Venezuela-Brazil border. At least two people were killed and 17 others were injured in clashes at Venezuela's border with Brazil, authorities said. Venezuelan security forces opened fire on a group of civilians who tried to prevent them from blocking the border. President Nicolás Maduro has closed the country's border with Brazil amid a row over the delivery of humanitarian aid.",kill injure clash venezuela brazil border least two people kill injure clash venezuela border brazil authority say venezuelan security force open fire group civilian try prevent block border president nicolas maduro close countrys border brazil amid row delivery humanitarian aid
US judge to scale Statue of Liberty before sentencing protestor,"A US judge overseeing the case against a woman convicted of climbing the base of the Statue of Liberty will climb the monument himself before sentencing her. Therese Okoumou had scaled the statue to protest US immigration policies. Judge Gabriel Gorenstein said he wanted to climb the statue ""to better appreciate the risks or hazards created by the defendant's conduct"". ",world,"US judge to scale Statue of Liberty before sentencing protestor. A US judge overseeing the case against a woman convicted of climbing the base of the Statue of Liberty will climb the monument himself before sentencing her. Therese Okoumou had scaled the statue to protest US immigration policies. Judge Gabriel Gorenstein said he wanted to climb the statue ""to better appreciate the risks or hazards created by the defendant's conduct"". ",us judge scale statue liberty sentencing protestor us judge oversee case woman convict climb base statue liberty climb monument sentence therese okoumou scale statue protest us immigration policy judge gabriel gorenstein say want climb statue better appreciate risk hazard create defendant conduct
"20 killed, 30 injured in China mine accident","At least 20 people were killed and 30 others were injured in a mine accident in China on Saturday when a vehicle transporting them underground experienced brake failure and lost control. According to a statement by the administration, 15 people died at the spot. A working team has been dispatched to guide and assist rescue and investigation at the site.",world,"20 killed, 30 injured in China mine accident. At least 20 people were killed and 30 others were injured in a mine accident in China on Saturday when a vehicle transporting them underground experienced brake failure and lost control. According to a statement by the administration, 15 people died at the spot. A working team has been dispatched to guide and assist rescue and investigation at the site.",kill injure china mine accident least people kill injure mine accident china saturday vehicle transport underground experienced brake failure lose control accord statement administration people die spot working team dispatch guide assist rescue investigation site
"Vietnam threatens to deport Trump, Kim Jong-un impersonators","Vietnam has threatened to deport Russell White and Howard X, the respective impersonators of US President Donald Trump and North Korean leader Kim Jong-un, ahead of the summit between the two leaders. They were detained after they staged a 'meeting' in Vietnam's capital Hanoi. The police told the pair they could only travel with an approved itinerary and travel guide.",world,"Vietnam threatens to deport Trump, Kim Jong-un impersonators. Vietnam has threatened to deport Russell White and Howard X, the respective impersonators of US President Donald Trump and North Korean leader Kim Jong-un, ahead of the summit between the two leaders. They were detained after they staged a 'meeting' in Vietnam's capital Hanoi. The police told the pair they could only travel with an approved itinerary and travel guide.",vietnam threaten deport trump kim jong un impersonator vietnam threaten deport russell white howard x respective impersonator us president donald trump north korean leader kim jong un ahead summit two leader detain stag meeting vietnam capital hanoi police tell pair could travel approve itinerary travel guide
Year-long emergency declared in Sudan amid anti-govt protests,"Sudan's President Omar al-Bashir has declared a year-long state of emergency and dissolved the central and the state governments amid the anti-government protests. The demonstrations, triggered by price rise and cash shortages, later developed into protests against Bashir's rule. He has also asked the Parliament to postpone constitutional amendments that would allow him to run for another term.",world,"Year-long emergency declared in Sudan amid anti-govt protests. Sudan's President Omar al-Bashir has declared a year-long state of emergency and dissolved the central and the state governments amid the anti-government protests. The demonstrations, triggered by price rise and cash shortages, later developed into protests against Bashir's rule. He has also asked the Parliament to postpone constitutional amendments that would allow him to run for another term.",year long emergency declare sudan amid anti govt protest sudan president omar al bashir declare year long state emergency dissolve central state government amid anti government protest demonstration trigger price rise cash shortage later develop protest bashir rule also ask parliament postpone constitutional amendment would allow run another term
Saudi Arabia looking to make India regional hub for oil supply,"Saudi Arabia Foreign Minister Adel bin Ahmed Al-Jubeir has said the country is looking to make India a regional hub for supplying crude oil. The world's biggest oil exporter will invest billions of dollars in India to build storage facilities and strengthen refineries, he added. It will also help the country boost its infrastructure in petrochemical sector, he further said.",world,"Saudi Arabia looking to make India regional hub for oil supply. Saudi Arabia Foreign Minister Adel bin Ahmed Al-Jubeir has said the country is looking to make India a regional hub for supplying crude oil. The world's biggest oil exporter will invest billions of dollars in India to build storage facilities and strengthen refineries, he added. It will also help the country boost its infrastructure in petrochemical sector, he further said.",saudi arabia look make india regional hub oil supply saudi arabia foreign minister adel bin ahmed al jubeir say country look make india regional hub supply crude oil world big oil exporter invest billion dollar india build storage facility strengthen refinery add also help country boost infrastructure petrochemical sector say
Drug lord Pablo Escobar's former home demolished in Colombia,"Colombian authorities on Friday demolished the former home of drug lord Pablo Escobar in the city of Medellín. The 'Monaco' building was vacant since 1988 after the Escobar family abandoned it following a bombing. In its place, the government is planning to build a memorial park to honour the victims of his drug cartel's crimes.",world,"Drug lord Pablo Escobar's former home demolished in Colombia. Colombian authorities on Friday demolished the former home of drug lord Pablo Escobar in the city of Medellín. The 'Monaco' building was vacant since 1988 after the Escobar family abandoned it following a bombing. In its place, the government is planning to build a memorial park to honour the victims of his drug cartel's crimes.",drug lord pablo escobar former home demolish colombia colombian authority friday demolish former home drug lord pablo escobar city medellin monaco building vacant since escobar family abandon follow bombing place government plan build memorial park honour victim drug cartel crime
